{
  "claimScope": "Result of the OBDS conformance runs for the exact release and suite hash named in this file, executed against the reference implementation named in `implementation`. Every required case ran; none was skipped, changed or expected to fail. `conformanceProfiles` lists only profiles this release can defend: `obds-foundation` because a declared conformance suite names that profile and every one of its cases passed, and `compiled-runtime` because every requirement section 26.2 lists names one or more executed cases in the `requirementsExercised` array of the `compiled-runtime` entry in `conformanceProfiles`, and the release gate resolves each of them against the suite it runs itself: the case must exist, must have passed and must not be reused for a second requirement. What the gate proves is that the named evidence really ran and really passed. That a case materially exercises the requirement it is attached to is an authoring judgement no name-resolving check can make, and it is claimed here rather than proven. No profile is claimed for context-delivery, context-assembly, visual-operations or composition; those suites are reported under `executedSuites` as coverage only, because they exercise modules other than the named implementation. This file is a suite result under section 26, not an independent certification and not a statement about any other implementation.",
  "conformanceProfiles": [
    {
      "basis": "reference/foundation/conformance-suite.yaml declares `profile: foundation`. It is the only artefact in this package that names a conformance profile. Every declared case is executed by the release build and re-executed by reference/release-gate.py; the result is published as OBDS-<release>-FOUNDATION-CONFORMANCE.json.",
      "conformanceSection": "26.1",
      "declaredCaseCount": 26,
      "declaredSuite": "reference/foundation/conformance-suite.yaml",
      "failedCount": 0,
      "id": "obds-foundation",
      "passedCount": 26,
      "suiteHash": "sha256:d5cd60d9f6e402fab1a3ccf3a35dc42db5c3761328f4ac69dbb3570b0dd821f2"
    },
    {
      "basis": "No declared per-profile conformance suite exists for section 26.2 in this release, so this is not a claim of the form 'passed the official 26.2 suite'. It is a claim that every requirement section 26.2 lists is implemented by the named reference compiler and exercised by a named executed case, enumerated in requirementsExercised. Defining a declared 26.2 suite is Phase B work.",
      "conformanceSection": "26.2",
      "id": "compiled-runtime",
      "requirementsExercised": [
        {
          "cases": [
            "foundation/tests.test_obds_200::test_exact_build_plans_bind_one_manifest"
          ],
          "requirement": "exact Build Plans"
        },
        {
          "cases": [
            "foundation/tests.test_reference::test_required_unknown_fails_and_emits_no_artefact"
          ],
          "requirement": "requiresDefined"
        },
        {
          "cases": [
            "foundation/tests.test_obds_11::test_required_knowledge_element_reaches_the_artefact"
          ],
          "requirement": "every required element present in the produced context"
        },
        {
          "cases": [
            "foundation/tests.test_obds_200::test_explicit_context_selection_decides_slot_contents"
          ],
          "requirement": "explicit context selection"
        },
        {
          "cases": [
            "foundation/tests.test_examples::test_fail_closed_example_emits_no_context_and_calls_no_model"
          ],
          "requirement": "no artefact for a failed target"
        },
        {
          "cases": [
            "foundation/tests.test_obds_200::test_canonical_json_artefacts_are_written_canonically",
            "foundation/tests.test_reference::test_canonical_json_normalises_nfc_and_line_endings"
          ],
          "requirement": "canonical JSON artefacts"
        },
        {
          "cases": [
            "foundation/tests.test_reference::test_simple_target_builds_and_hash_is_reproducible"
          ],
          "requirement": "reproducible hashes"
        },
        {
          "cases": [
            "foundation/tests.test_obds_11::test_governed_result_hash_matches_the_fixture",
            "foundation/tests.test_obds_11::test_compiled_context_carries_the_governed_result_hash"
          ],
          "requirement": "a governedResultHash that matches section 14.3a for the same manifest and Build Plan"
        },
        {
          "cases": [
            "foundation/tests.test_obds_200::test_foundation_check_registry_v1_compiles_and_refuses"
          ],
          "requirement": "Foundation Check Registry v1"
        },
        {
          "cases": [
            "foundation/tests.test_obds_200::test_exact_target_loading_builds_only_the_named_target",
            "foundation/tests.test_reference::test_invalid_hash_no_call"
          ],
          "requirement": "exact target loading"
        },
        {
          "cases": [
            "foundation/tests.test_reference::test_runtime_record_ndjson",
            "foundation/tests.test_reference::test_assembly_failed_runtime_record_is_schema_valid"
          ],
          "requirement": "Runtime Decision Records"
        },
        {
          "cases": [
            "foundation/tests.test_reference::test_failed_build_means_no_model_call",
            "foundation/tests.test_reference::test_blocking_preflight_means_no_model_call"
          ],
          "requirement": "zero instrumented model calls after failed build or blocking preflight"
        },
        {
          "cases": [
            "foundation/tests.test_reference::test_blocking_postflight_withholds_output"
          ],
          "requirement": "withheld output after blocking postflight"
        },
        {
          "cases": [
            "foundation/tests.test_obds_200::test_per_slot_token_reporting_is_the_sum_of_its_slots"
          ],
          "requirement": "per-slot token reporting"
        },
        {
          "cases": [
            "foundation/tests.test_obds_300_class_a::test_a1_every_governed_reader_is_the_one_governed_reader",
            "foundation/tests.test_obds_300_class_a::test_a2_readers_agree_on_every_shipped_governed_document"
          ],
          "requirement": "the governed input contract at every governed reader"
        },
        {
          "cases": [
            "foundation/tests.test_obds_300_class_b::test_b2_one_content_hash_cannot_resolve_to_two_governed_identities",
            "foundation/tests.test_obds_300_class_b::test_b1_a_shared_field_is_an_identity_position_in_every_artefact_that_carries_it"
          ],
          "requirement": "identity binding of the manifest triple wherever an artefact names a manifest"
        },
        {
          "cases": [
            "foundation/tests.test_obds_300_class_c::test_c10_a_deferred_literal_passes_the_stage_that_authors_it",
            "foundation/tests.test_obds_300_class_c::test_c10_a_deferred_literal_is_still_refused_once_it_should_have_been_resolved"
          ],
          "requirement": "two-stage validation of Foundation RULE checks"
        },
        {
          "cases": [
            "foundation/tests.test_obds_300_class_c::test_c9_a_forged_rendered_task_input_never_reaches_the_model",
            "foundation/tests.test_obds_300_class_c::test_c9_a_decoy_task_input_never_reaches_the_model"
          ],
          "requirement": "exact task-input binding"
        },
        {
          "cases": [
            "foundation/tests.test_obds_300_systemic_executors::test_the_assembled_runtime_executes_the_model_input_package_contract[another kind]",
            "foundation/tests.test_obds_300_systemic_executors::test_mechanism_4_no_executor_accepts_a_resealed_schema_invalid_artefact[missing required property-reference/foundation/src/obds_ref/cli.py::command_validate]"
          ],
          "requirement": "contract validation of every governed runtime document before governed field use"
        },
        {
          "cases": [
            "foundation/tests.test_obds_300_class_b::test_b2_a_resolution_snapshot_must_reproduce_its_approval_hash"
          ],
          "requirement": "governed hashes reproduced rather than declared"
        },
        {
          "cases": [
            "foundation/tests.test_obds_400_boundaries::test_f1_safe_target_mapping_without_id_restriction[../escaped]",
            "foundation/tests.test_obds_400_boundaries::test_f1_output_symlinks_are_refused[generations]"
          ],
          "requirement": "contained production output paths"
        },
        {
          "cases": [
            "foundation/tests.test_obds_400_boundaries::test_f2_failed_generation_never_falls_back_and_rollback_is_explicit"
          ],
          "requirement": "explicit immutable build generations without fallback"
        },
        {
          "cases": [
            "foundation/tests.test_obds_400_boundaries::test_f3_resealed_slot_cannot_reach_model_or_review[replace-hardBoundaries]",
            "foundation/tests.test_obds_400_boundaries::test_f3_resealed_slot_cannot_reach_model_or_review[replace-factGrounding]",
            "foundation/tests.test_obds_400_boundaries::test_f3_resealed_slot_cannot_reach_model_or_review[replace-stateMap]",
            "foundation/tests.test_obds_400_boundaries::test_f3_resealed_slot_cannot_reach_model_or_review[replace-guidanceContext]"
          ],
          "requirement": "verified provenance of all four governed model projection slots"
        },
        {
          "cases": [
            "foundation/tests.test_obds_400_boundaries::test_f5_model_failed_is_recorded_and_never_released[timeout-False]",
            "foundation/tests.test_obds_400_boundaries::test_f5_model_failed_is_recorded_and_never_released[timeout-True]"
          ],
          "requirement": "provider failure evidence with model_failed"
        }
      ]
    }
  ],
  "executedSuites": {
    "counts": {